,doc_sent_idx,sent_type,snt
3984,389,f,"The experiment in (B) was repeated, and this time, total RNAs were isolated from keratinocytes treated with TGF-β2 for the indicated times."
3985,390,f,RT-PCR was then used with (+) or without (–) reverse transcriptase (RT) and with primer sets specific for <i>Snail</i> and GAPDH mRNAs.
3986,391,f,"Note that <i>Snail</i> mRNA expression also peaked at 2 h, paralleling Snail protein."
3987,392,f,(D) TGF-β2 treatment results in enhanced activity of a <i>Snail</i> promoter-β-galactosidase reporter.
3988,393,f,Keratinocytes were transfected with a β-galactosidase reporter driven by a <i>Snail</i> promoter that is either WT (wt prom) or harbors a mutation in a putative pSMAD2/pSMAD4 binding site (mt prom).
3989,394,f,"At 2 d posttransfection, cells were treated with either TGF-β or heat-inactivated TGF-β2 (inact) for the times indicated."
3990,395,f,"β-galactosidase assays were then conducted, and results are reported as fold increase over a basal level of activity of 1."
3991,396,f,"The experiment was repeated three times in triplicate, and error bars reflect variations in the results."
3992,397,ft,Figure 6
3993,398,f,"(A–D) Skins from TGF-β2 WT or KO E17.5 embryos were analyzed for expression of TGF-β2 protein (A), which is present in the epidermis and dermis as previously described [<xref ref-type=""bibr"" rid=""pbio-0030011-b33"">33</xref>] and in the hair bud, pSMAD2 (B), Snail (C), and <i>Snail</i> mRNA (D)."
3994,399,f,Arrows point to the hair buds.
3995,400,f,(E) Western blot analyses of Snail expression in the skins of 2-wk-old <i>K14-Smad2</i> transgenic (SMAD2 TG) and WT littermate (WT) mice.
3996,401,f,Antibody to tubulin was used as a control for equal protein loadings.
3997,402,f,"The K14-Smad2 Tg mouse was previously shown to possess activated TGF-β signaling [<xref ref-type=""bibr"" rid=""pbio-0030011-b35"">35</xref>]."
3998,403,f,(F–G) Proliferation markers Ki67 (F) and pMAPK (G) are diminished in <i>TGF-β2</i>-null hair relative to its WT counterpart.
3999,404,f,(H–J) <i>TGF-β2</i>-null hair fails to down-regulate E-cadherin (H).
4000,405,f,Wnt and noggin signaling pathways are still intact in the TGF-β2 null hair as nuclear LEF-1 (I) and nuclear β-catenin (J) are still expressed.