,doc_sent_idx,sent_type,snt
3821,226,b,Conditional gene targeting studies will be necessary to establish whether Snail family members also contribute to the down-regulation in <i>E-cadherin</i> gene expression that occurs during follicle formation.
3822,227,b,"However, it is intriguing that <i>K14-Snail</i> Tg epidermis displayed a marked down-regulation in E-cadherin expression, thereby demonstrating its potential to do so in skin."
3823,228,b,"Our prior findings showed that by elevating E-cadherin levels or by conditionally ablating <i>α-catenin,</i> hair follicle morphogenesis can be impaired [<xref ref-type=""bibr"" rid=""pbio-0030011-b04"">4</xref>,<xref ref-type=""bibr"" rid=""pbio-0030011-b07"">7</xref>]."
3824,229,b,"The marked epidermal hyperproliferation seen in the <i>K14-Snail</i> Tg skin, coupled with the converse suppression of proliferation and Snail in <i>TGF-β2</i>-null hair buds led us to wonder whether the down-regulation of E-cadherin during follicle morphogenesis might have a direct impact on elevating the proliferative state of these cells."
3825,230,b,"Our Tg studies suggested that, at least in part through its regulation of <i>E-cadherin</i>, Snail is able to influence the subcellular localization of a variety of AJ-associated proteins."
3826,231,b,"One of these appears to be Ajuba, which was previously shown to have the dual capacity to bind Grb-2 as well as α-catenin [<xref ref-type=""bibr"" rid=""pbio-0030011-b09"">9</xref>,<xref ref-type=""bibr"" rid=""pbio-0030011-b10"">10</xref>]."
3827,232,b,"Our studies revealed that in skin keratinocytes that either harbor a conditional null mutation in <i>α-catenin</i> or that overexpress Snail, Ajuba develops an interaction with Grb-2 that is otherwise not observed in WT keratinocytes."
3828,233,b,The corresponding abilities of either <i>Snail</i>-transfected or <i>Ajuba</i>-transfected keratinocytes to exhibit elevated activation of the Ras-MAPK pathway suggest that the Grb-2 association of Ajuba under conditions of reduced levels of AJ proteins may be directly relevant to the parallel in hyperproliferation.
3829,234,b,"In stable epithelial (i.e., Madin-Darby canine kidney, or MDCK) cell lines, Snail has been shown to block cell cycle progression and promote motility and shape changes for invasion [<xref ref-type=""bibr"" rid=""pbio-0030011-b47"">47</xref>]."
3830,235,b,"While our in vivo studies are consistent with a role for Snail in motility and epithelial remodeling, they differ with respect to Snail's apparent proliferative effects."
3831,236,b,"A priori, this could be simply due to variations in the response of different cell types to Snail expression."
3832,237,b,"Alternatively, these differences may be relevant to the benefit of using mouse models to reveal functions not always recapitulated in stable cell line models."
3833,238,b,Future studies should highlight the underlying reasons for these opposing results.
3834,239,b,"Irrespective of these differences, our in vivo studies do not stand alone, as there are many situations in which a down-regulation in AJ proteins correlate with enhanced proliferation."
3835,240,b,"In fact, a myriad of diverse mechanisms have been implicated in activating epithelial proliferation upon down-regulation of AJ proteins [<xref ref-type=""bibr"" rid=""pbio-0030011-b07"">7</xref>,<xref ref-type=""bibr"" rid=""pbio-0030011-b23"">23</xref>,<xref ref-type=""bibr"" rid=""pbio-0030011-b24"">24</xref>,<xref ref-type=""bibr"" rid=""pbio-0030011-b48"">48</xref>]."
3836,241,b,Sifting through these converging pathways is likely to be a difficult and painstaking process.
3837,242,b,"This said, by identifying the status of different players involved in specific cell types and at specific stages in development, our mechanistic understanding of how intercellular remodeling is linked to proliferation in epithelial morphogenesis should begin to surface in the future."
3838,243,b,Elucidating the molecular mechanisms through which these networks converge is also a prerequisite for understanding how these processes go awry during tumorigenesis.
3839,244,s,Materials and Methods
3840,245,s,Reagents
3841,246,b,"Primary antibodies used were against: E-cadherin (M. Takeichi, Kyoto University, Japan); α-catenin, β-catenin, pMAPK, tubulin (Sigma, St. Louis, Missouri, United States), Ajuba (G. Longmore, Washington University, St. Louis, Missouri, United States); β4 integrin/CD104 (BD Pharmingen, San Diego, California, United States), laminin 5 (R. Burgeson, Harvard University, Cambridge, Massachusetts, United States), K5, K1, loricrin (Fuchs Lab), involucrin, fillagrin (Covance, Berkeley, California, United States), MAPK, pSMAD2 (Cell Signaling, Beverly, Massachusetts, United States); Grb-2 (Santa Cruz Biotech, Santa Cruz, California, United States); P-cadherin (Zymed Laboratories, South San Francisco, California, United States); HA (Roche Biochemicals), vimentin (Chemicon, Temecula, California, United States), Ki67 (Novo Castra, Newcastle Upon Tyne, United Kingdom), keratin 6 (P. Coulombe, John Hopkins University, Baltimore, Maryland, United States), cyclin D (Oncogene, San Diego, California, United States), and TGF-β2 (L. Gold, New York University, New York, New York, United States)."
3842,247,b,"FITC-, Texas Red-, or HRP-conjugated secondary antibodies were from Jackson ImmunoResearch (West Grove, Pennsylvania, United States)."
3843,248,b,"Biotinylated secondary antibodies were from Vector Labs (Burlingame, California, United States)."
3844,249,b,Dilutions were according to the manufacturer's recommendation.
3845,250,b,"The Snail antibody was generated in Guinea pigs by inoculating them with the N-terminal sequence of murine <i>Snail</i> fused to GST (Covance, Princeton, New Jersey, United States)."
3846,251,b,"Recombinant human TGF-β2 was purchased from R&D (Minneapolis, Minnesota, United States)."
3847,252,b,Heat inactivated TGF-β2 was generated by heating the recombinant protein at 100 °C for 10 min.
3848,253,s,Mice
3849,254,b,"The <i>K14-Snail</i> Tg mouse was generated by digesting the pcDNA3-mm <i>Snail</i>-HA plasmid (G. de Herreros, Universitat Pompeu, Fabra, Barcelona, Spain) with BamHI and NotI and subcloned into the K14 vector [<xref ref-type=""bibr"" rid=""pbio-0030011-b49"">49</xref>]."
3850,255,b,The linearized construct was injected into the nucleus of embryos from CD1 mice.
3851,256,b,"The <i>K14-Smad 2</i> Tg mouse was reported in Ito et al., 2001."
3852,257,b,"The <i>TGF-β2</i> knockout (KO) mouse was described in [<xref ref-type=""bibr"" rid=""pbio-0030011-b34"">34</xref>]."
3853,258,b,"The <i>shh</i> KO mouse [<xref ref-type=""bibr"" rid=""pbio-0030011-b38"">38</xref>] and TOPGal mouse [<xref ref-type=""bibr"" rid=""pbio-0030011-b20"">20</xref>] have previously been reported."
3854,259,s,Western blot and immunoprecipitation
3855,260,b,"Protein extracts from primary keratinocytes were generated either by lysing cells in lysis buffer (1% NP-40, 1% sodium deoxycholate, 20 mM Tris-Cl [pH 7.4], 140 mM NaCl containing 1 mM sodium vanadate, 2 mM phenylmethylsulfonyl fluoride, and protease inhibitors) or directly in Laemmli bβuffer and boiled."
3856,261,b,For skin tissue: Frozen tissue was pulverized in a liquid nitrogen-cooled Gevebesmascher and the powder scraped into a chilled microcentrifuge tube.
3857,262,b,"RIPA buffer (1% Triton X-100 in PBS with 10 mM EDTA, 150 mN NaCl, 1% sodium deoxycholate, and 0.1% SDS) and protease inhibitors or Laemmli buffer was added."
3858,263,b,"The cell suspension was sonicated three times for 15 s and centrifuged at 14,000 rpm at 4 °C."
3859,264,b,The supernatant was separated from the pellet and used in the experiments.
3860,265,b,"Extracts subjected to immunoprecipitation were precleared with Protein G Sepharose (Amersham, Piscataway, New York, United States) and incubated with antibody with rocking overnight at 4 °C."
3861,266,b,Protein G Sepharose was added and samples were incubated for 1 h at 4 °C with rocking.
3862,267,b,"Samples were washed three times for 5 min each in lysis buffer, and the Protein G Sepharose-antibody-antigen pellet was resuspended in Laemmli buffer and boiled for 10 min."
3863,268,b,"Samples were run on SDS-PAGE and transferred to nitrocellulose membrane (Schleicher and Schuell Bioscience, Keene, New Hampshire, United States)."
3864,269,s,Western blot signals were developed using the enhanced chemiluminescence kit from Amersham
3865,270,s,Cell culture
3866,271,b,"Primary keratinocytes were culture in low-calcium medium as previously described [<xref ref-type=""bibr"" rid=""pbio-0030011-b04"">4</xref>]."
3867,272,b,"Transient transfections were carried out with FuGENE6 reagent (Roche, Indianapolis, Indiana, United States) according to the manufacturer's protocol."
3868,273,b,"Measurement of β-galactosidase or luciferase levels in promoter activity studies were carried out with the Galacto-Lite assay kit (TROPIX, Bedford, Massachusetts, United States) and the Dual luciferase (Promega, Madison, Wisconsin, United States), respectively."
3869,274,b,Runella luciferase was cotransfected into cells to correct for transfection efficiency.
3870,275,b,Experiments were done in triplicate and repeated at least three times.
3871,276,b,"Measurements were done on a luminometer (MGM Instruments, Hamden, Connecticut, United States)."
3872,277,b,"For experiments measuring phosphorylation of MAPK, keratinocytes were serum starved for 3 h prior to harvesting of cells by incubation in medium lacking serum."
3873,278,b,"Treatment of cells with Wnt- and noggin-conditioned medium was previously described [<xref ref-type=""bibr"" rid=""pbio-0030011-b04"">4</xref>]."
3874,279,s,Constructs
3875,280,b,"The 2.2-kb murine <i>Snail</i> promoter was generated by PCR using a forward primer with an XbaI linker sequence, 5′-TCTAGAATTGTTTGCTGCTGTATGGTCTTC-3′, along with a reverse primer with a BglII linker sequence, 5′-AGATCTGTTGGCCAGAGCGACCTAG-GTAG-3′, and mouse genomic DNA as a template."
3876,281,b,"The PCR product was purified with the Gel Extraction Kit (Qiagen, Valencia, California, United States) and ligated into pCRII-TOPO TA vector (Invitrogen, Carlsbad, California, United States)."
3877,282,b,"The promoter was verified by sequencing and digested with XbaI and BglII and subcloned into the pβ-gal BASIC vector (BD Biosciences Clontech, Palo Alto, California, United States)."
3878,283,b,"The point mutations in the SMAD binding element was generated with the Quik-Change Kit (Stratagene, La Jolla, California, United States) using the forward primer 5′-GGGCGGGCTTAGGTGTTTTCATTTACTCTTGAGGAAAAGCTTGGC-3′ and the reverse primer 5′-GCTTTT-CCTCAAGAGTAAATGAAAACACCTAAGCCCGCCCTGCCC-3′."
3879,284,b,"The probes for the <i>Snail</i> in situ hybridization were generated against the 3′ UTR by PCR using the forward primer 5′-ACCTTCTCCCGCATGTCCTTGCTCC-3′ and the reverse primer 5′-CTGCTGAGGCATGGTTACAGCTGG-3′, and genomic DNA as a template."
3880,285,b,The PCR product was gel purified and ligated into pCRII-TOPO TA vector.
3881,286,b,"The pre-LIM domain of Ajuba was generated essentially as described [<xref ref-type=""bibr"" rid=""pbio-0030011-b09"">9</xref>], but was fused to GFP by subcloning from the pEGFP-N1 20 vector (BD Biosciences Clontech)"
3882,287,s,In situ hybridization
3883,288,b,The pCRII-TOPO TA vector containing a region of the 3′ UTR of <i>Snail</i> was used as a template to generate digoxigenin-labeled sense and antisense riboprobes (Roche).
3884,289,b,The respective probes were obtained by XhoI and BamH1 digestions.
3885,290,b,In situ hybridizations were performed on 10-μm thick sections of E17.5 mouse embryos.
3886,291,b,"The sections were fixed with 4% PFA for 10 min at room temperature, prehybridized at room temperature for 4.5 h, hybridized with the probe (2 μg/ml) at 55 °C for 12–14 h, blocked with 10% NGS, and treated with anti-dig Fab-AP antibody (Roche #1093274) at a 1:2,500 dilution for 3 h."
3887,292,b,The sections were incubated with NBT and BCIP until adequate signal was detected.
3888,293,s,Immunofluorescence and immunohistochemistry
3889,294,b,Tissue samples for immunofluorescence were frozen in OCT and sectioned 10 μm thick on a cryostat.
3890,295,b,"Sections were fixed in 4% paraformaldehyde for 10 min at room temperature, blocked, and stained with antibodies."
3891,296,b,"Tissue samples for immunohistochemistry were fixed in 4% paraformaldehyde, dehydrated, and embedded in paraffin."
3892,297,b,Samples were sectioned on a microtome (10 μm thick) and rehydrated prior to staining with antibody.
3893,298,b,"Samples stained with Snail, pMAPK, pSmad2, and cyclin D were antigen unmasked with 10 mM sodium citrate (pH 6) in an Antigen Retriever 2100 (Pickcell Laboratories, Leiden, Netherlands)."
3894,299,b,The DAB substrate kit (Vector Labs) was used according to manufacturer's instructions to develop the signal.
3895,300,s,RT-PCR
3896,301,b,RNA was extracted from keratinocytes or skin tissue with Trizol (Invitrogen) according to the manufacturer's protocol.
3897,302,b,cDNA was generated using oligo-dT primers and the Superscript II kit (Invitrogen).
3898,303,b,The primers used for PCR were <i>Snail</i> forward: 5′-CAGCTGGCCAGGCTCTCGGT-3′; <i>Snail</i> reverse: 5′-GCGAGGGCCTCCGGAGCA-3′; GAPDH forward 5′-CGTAGACAAAATGGTGAAGGTCGG-3′; and GAPDH reverse: 5′-AAGCAGTTGGTGGTGCAGGATG-3′.
3899,304,ft,Figure 1
3900,305,f,"Embryos were either frozen in OCT embedding compound (A, F, and H) or embedded in paraffin (C, D, E, and G), and then sectioned (8 μm)."
3901,306,f,(A) In situ hybridizations with <i>Snail</i> sense or antisense cRNA probes.
3902,307,f,Black dotted lines demarcate the basement membrane that separates the epidermis (epi) from dermis (der).
3903,308,f,"Arrows point to <i>Snail</i> RNA expression, restricted to the hair bud stage of follicle morphogenesis."
3904,309,f,It was not seen in later hair germ or peg stages.
3905,310,f,(B) Expression of Snail protein coincides with hair development.
3906,311,f,"Protein extracts were prepared from keratinocytes transfected with empty expression vector (K14), containing the K14 promoter or with the vector driving HA-tagged <i>Snail</i> (K14-<i>Snail</i>); or from whole skin from E13.5 to P5 animals, including newborn (nb)."
3907,312,f,"Equal amounts of proteins were then resolved by SDS-PAGE through 12% gels and subjected to Western blotting using either an affinity-purified Snail polyclonal antiserum, which we generated, or anti-tubulin (loading control)."
3908,313,f,(C–E) Immunohistochemistry shows expression of Snail protein in the nuclei of cells within the hair and skin.
3909,314,f,(C) E13.5 skin with a single layered epidermis (epi) shows no Snail expression.
3910,315,f,(D) The first morphological sign that cells have adopted a hair follicle fate is a cluster of cells called a placode in E16.5 skin.
3911,316,f,Snail is not expressed at this stage of development.
3912,317,f,(E) Snail is expressed in the hair bud of E17.5 skin but not in later stages of development such as the germ or peg.
3913,318,f,"(F) Immunofluorescence with anti-Ki67 (green) identifies the proliferating cells of the skin, restricted to the basal layer of the epidermis and developing hair follicles."
3914,319,f,"Anti-β4 int labeling reveals the presence of the hemidesmosomal integrin β4, restricted to the base of cells adhering to the underlying basement membrane."
3915,320,f,The white dotted line marks the outermost surface of the skin.
3916,321,f,(G) Immunohistochemistry with pMAPK marks a subset of proliferating cells within the epidermis and hair bud.
3917,322,f,Anti-pMAPK labeling was consistently robust within the hair bud.
3918,323,f,"(H) Immunofluorescence with anti-laminin 5 (lam5), which demarcates the basement membrane, and anti-E-cadherin (E-cad), a component of AJs."
3919,324,f,"At the leading edge of the growing bud, cell-cell borders show markedly diminished anti-E-cadherin labeling (arrowheads)."
3920,325,ft,Figure 2
3921,326,f,"Three different surviving Tg founder mice harbored a <i>K14-Snail</i> transgene that was integrated into a locus that resulted in inheritable, mosaic expression of the transgene in skin epidermis."
3922,327,f,"All displayed similar abnormalities, as did their offspring."
3923,328,f,(A) P16 WT and <i>K14-Snail</i> Tg mice.
3924,329,f,"Insets denote magnified tail segments, which displayed a mosaic, flaky appearance in Tg mice."
3925,330,f,"Size differences appeared with age, and are likely due to K14-promoter activity in the tongue and oral epithelium, resulting in progressive defects and reduced food intake."
3926,331,f,"Hence, skin sections from young (P3) mice were analyzed (B–I)."
3927,332,f,(B) Hematoxylin- and eosin-stained Tg skin section.
3928,333,f,"Double arrows demarcate the border of mosaic histology, with seemingly normal epidermis (epi) and a mature hair follicle (hf) at left and hyperthickened epidermis at right."
3929,334,f,(C) Immunofluorescence of Tg skin section labeled with antibodies as color-coded on frame.
3930,335,f,"Double arrows demarcate the border of mosaic anti-Snail (green), revealing Snail expression coincident with regions of hyperthickened epidermis (at left) and absent in regions of normal epidermis (at right)."
3931,336,f,"(D–I) Sections of P3 WT or Tg skin (affected region) subjected to either immunofluorescence (D, E, H, and I) or immunohistochemistry (F and G) with antibodies as indicated on the panel."
3932,337,f,"Anti-keratin 5 indicates K5, normally restricted to the basal layer of the epidermis; anti-keratin 6 detects keratin 6, expressed in postnatal epidermis under conditions such as wounding, in which hyperproliferation occurs."
3933,338,f,"All other antibodies are as in the legend to <xref ref-type=""fig"" rid=""pbio-0030011-g002"">Figure 2</xref>."
3934,339,f,Comparison of D and E provide representative examples that illustrate that pMAPK is found in only a subset of all proliferating (Ki67-positive) cells.
3935,340,f,Note also the presence of Ki67- (E) and pMAPK-positive (G) cells in some suprabasal areas; Ki67-positive cells colabeled with anti-Snail (E).
3936,341,ft,Figure 3
3937,342,f,(A–H) Immunofluorescence of skin sections from P3 WT and Tg mice.
3938,343,f,"Shown are affected areas of Tg skin; in areas where Snail protein was not expressed, stainings were normal."
3939,344,f,Sections were labeled with antibodies as indicated and color-coded on each frame.
3940,345,f,"Antibodies are against markers of normal epidermal differentiation, and include K5 (a basally expressed keratin), K1 (a suprabasal keratin, expressed in spinous layer cells), involucrin (Inv; a suprabasally expressed cornified envelope protein found in upper spinous and granular layer cells), loricrin (Lor; a cornified envelope protein expressed in the granular layer), and filaggrin (Fil; a protein that bundles keratin filaments in the granular layer and stratum corneum)."
3941,346,f,"Note abnormal extension of anti-K5 suprabasally, often present in anti-K1 positive suprabasal Tg cells."
3942,347,f,"(I–N) Immunohistochemistry (I and J) or immunofluorescence (K–N) of sections of P30 Wt (I, K, and M) and Tg (J, L, and N) (affected areas) skins using the antibodies indicated."
3943,348,f,"Note that with age, affected areas of the Tg epidermis became increasingly undulating, often exhibiting papilloma-like invaginations (J)."
3944,349,f,"Insets in I and J are magnified views of the boxed areas, illustrating the absence (Wt) or presence (Tg) of nuclear anti-cyclin D staining."
3945,350,f,"With age, affected areas of the Tg epidermis also displayed perturbations within the basement membrane, as judged by antibody labeling against either basement membrane (K and L) or hemidesmosomal (M and N) components."
3946,351,f,"Double arrows in L demarcate mosaic zones, revealing that perturbations were restricted to hyperthickened, i.e., Snail-positive zones (to left of double arrows)."
3947,352,f,"Other abbreviations are as noted in the legend to <xref ref-type=""fig"" rid=""pbio-0030011-g002"">Figure 2</xref>."
3948,353,ft,Figure 4
3949,354,f,(A) Immunofluorescence of skin sections from P30 Wt and Tg mice.
3950,355,f,"Shown are affected areas of Tg skin; in areas where Snail protein was not expressed, stainings were normal."
3951,356,f,"Antibodies used are against AJ proteins and include E-cadherin (E-cad), the transmembrane core protein; β-catenin (β-cat), which binds E-cadherin at AJs and which can also participate as a transcription cofactor when associated with LEF-1/TCF proteins in the nucleus; α-catenin (α-cat) which binds to both β-catenin and Ajuba, a close relative of zyxin; and Ajuba, which can associate with proteins that bind to the actin cytoskeleton, as well as with Grb-2, a mediator of the GTP nucleotide-exchange protein Sos, involved in activation of the Ras-MAPK signaling cascade."
3952,357,f,"In Snail-expressing Tg regions, there was a reduced staining with anti-E-cad and anti-α-cat and a more diffuse staining with anti-Ajuba."
3953,358,f,Insets in the panels for β-catenin and Ajuba staining are magnified views of the boxed areas.
3954,359,f,Arrows mark membrane localization of the protein and asterisks mark cells with elevated levels of cytoplasmic β-catenin or Ajuba.
3955,360,f,(B) Western blot analyses of protein extracts from P30 Wt and Tg back and ear skins.
3956,361,f,"Antibodies are as in (A) except anti-P-cad, which detects P-cadherin, whose expression in the hair follicle was not affected, and anti-tubulin, which detects tubulin, a control for equal protein loadings."
3957,362,f,"Note that the reductions seen in E-cadherin and α-catenin are likely to be underestimates of the actual differences in affected regions, since the Tg skin expressed Snail mosaically."
3958,363,f,"(C) In the presence of elevated Snail, α-catenin levels can be restored by overexpression of E-cadherin."
3959,364,f,Keratinocytes were transfected with either HA-tagged Snail (Snail[HA]; images on the left) or Snail(HA) and Ecad(HA) (images on the right).
3960,365,f,"2 d after transfection, cells were switched from low-calcium growth medium to high-calcium medium for 6 h to induce AJ formation."
3961,366,f,Cells were stained with antibodies as indicated on the panels.
3962,367,f,Arrowheads point to sites of intercellular contact between a Snail-transfected keratinocyte and its neighboring untransfected cell.
3963,368,f,(D) Reintroduction <i>of E-cadherin</i> in keratinocytes expressing Snail returns pMAPK to basal levels.
3964,369,f,"Keratinocytes were transfected with control vector (K14), or <i>Snail(HA),</i> or <i>Snail(HA)</i> + <i>E-cad(HA)</i>."
3965,370,f,"After 2 d, cells were serum starved for 4 h and whole cell lysates were made and Western blotted with antibodies to pMAPK, HA to recognize the HA-tagged Snail and E-cadherin protein, 20or tubulin as a loading control."
3966,371,f,(E) Ajuba interacts with Grb-2 under conditions where α-catenin levels are reduced.
3967,372,f,"Protein extracts were made from skins of P30 Wt and <i>K14-Snail</i> Tg P30 mice (blots on the left) and of newborn Wt and <i>K14-Cre/α-catenin (fl/fl)</i> conditionally null animals (blots on the right) [<xref ref-type=""bibr"" rid=""pbio-0030011-b07"">7</xref>]."
3968,373,f,"Equal amounts of protein extracts were treated with anti-Grb-2 antibody (+) or control isotype antibody (–), and following centrifugation, immunoprecipitates were subjected to SDS-PAGE and Western blot analysis with anti-Ajuba and anti-Grb-2 antibodies."
3969,374,f,Note the presence of Ajuba only under conditions where levels of α-catenin and other AJ proteins were aberrantly low or absent.
3970,375,f,(F) Transgene expression of excess Ajuba or the Grb-2-interacting domain (pre-LIM) of Ajuba in keratinocytes results in the activation of the Ras-MAPK pathway.
3971,376,f,"Primary newborn mouse keratinocytes were transfected with either the empty K14 expression vector (K14), or the expression vector driving Snail, full length Ajuba, or the pre-LIM domain of Ajuba in the absence or presence of a peptide inhibitor (inh) that disrupts the interaction between Grb-2 and Sos."
3972,377,f,"48 h posttransfection, protein extracts were prepared and subjected to SDS-PAGE and Western blot analyses with antibodies against pMAPK, total MAPK, Ajuba (also recognizing the smaller, pre-LIM domain), and Snail."
3973,378,ft,Figure 5
3974,379,f,(A) Failure of Wnt and noggin signaling to induce Snail in cultured keratinocytes.
3975,380,f,Primary mouse keratinocytes were treated with Wnt- and/or noggin-conditioned medium (+) or the corresponding control medium (–).
3976,381,f,"These conditions are known to activate the LEF-1/β-catenin reporter TOPGal and down-regulate the <i>E-cadherin</i> promoter (see [<xref ref-type=""bibr"" rid=""pbio-0030011-b04"">4</xref>] for details)."
3977,382,f,"Using Western blot analyses, cellular proteins were then analyzed for Snail, LEF-1, β-catenin, and tubulin."
3978,383,f,Proteins from keratinocytes transfected with K14-<i>Snail</i> were used as a positive control for Snail expression.
3979,384,f,(B) TGF-β2 can induce Snail protein.
3980,385,f,Primary keratinocytes were treated for the indicated times with recombinant TGF-β2 (+) or heat inactivated TGF-β2 (–).
3981,386,f,"Total cellular proteins were then isolated and analyzed by Western blot for Snail, pSMAD2 (reflective of activated TGF- signaling), and tubulin."
3982,387,f,"Note the activation of Snail expression, peaking at 2 h post-TGF-β2 treatment and then disappearing thereafter."
3983,388,f,(C) <i>Snail</i> mRNA expression is transiently induced by TGF-β2.
