,doc_sent_idx,sent_type,snt
3596,1,s,A Signaling Pathway Involving TGF-β2 and Snail in Hair Follicle Morphogenesis (PMID:15630473)
3597,2,a,"In a common theme of organogenesis, certain cells within a multipotent epithelial sheet exchange signals with their neighbors and develop into a bud structure."
3598,3,a,"Using hair bud morphogenesis as a paradigm, we employed mutant mouse models and cultured keratinocytes to dissect the contributions of multiple extracellular cues in orchestrating adhesion dynamics and proliferation to shape the cluster of cells involved."
3599,4,a,We found that transforming growth factor β2 signaling is necessary to transiently induce the transcription factor Snail and activate the Ras-mitogen-activated protein kinase (MAPK) pathway in the bud.
3600,5,a,"In the epidermis, <i>Snail</i> misexpression leads to hyperproliferation and a reduction in intercellular adhesion."
3601,6,a,"When <i>E-cadherin</i> is transcriptionally down-regulated, associated adhesion proteins with dual functions in signaling are released from cell-cell contacts, a process which we demonstrate leads to Ras-MAPK activation."
3602,7,a,"These studies provide insights into how multipotent cells within a sheet are stimulated to undergo transcriptional changes that result in proliferation, junctional remodeling, and bud formation."
3603,8,a,This novel signaling pathway further weaves together the web of different morphogens and downstream transcriptional events that guide hair bud formation within the developing skin.
3604,9,a,"The study of hair follicle morphogenesis provides insights into how cells within a sheet can be triggered to proliferate, remodel, and form buds - a recurring theme in development"
3605,10,s,Introduction
3606,11,b,Mammalian development involves the morphogenesis of complex three-dimensional structures from seemingly uniform sheets or masses of cells.
3607,12,b,"A simple bud-like structure initiates the formation of many organs, including lungs, spinal cord, mammary glands, and hair follicles [<xref ref-type=""bibr"" rid=""pbio-0030011-b01"">1</xref>]."
3608,13,b,"The multipotent, adhering epithelial cells are typically attached to an underlying basal lamina that polarizes the epithelial sheet and separates it from surrounding mesenchyme."
3609,14,b,Budding morphogenesis is guided by a reciprocal exchange of signals between epithelium and mesenchyme to specify the identity of the organ that will form and to govern its growth.
3610,15,b,"At the helm of these molecular communication pathways are Wnts, bone morphogenic proteins (BMPs), transforming growth factor βs (TGF-βs), and fibroblast growth factors (FGFs)."
3611,16,b,"Through activation of cell surface transmembrane receptors, these external signaling molecules trigger distinct cascades of intracellular events that culminate in changes in gene expression, growth, and differentiation [<xref ref-type=""bibr"" rid=""pbio-0030011-b02"">2</xref>]."
3612,17,b,How this constellation of signals collaborates in tailoring each budding process so that it executes a distinct morphogenetic program has yet to be comprehensively defined.
3613,18,b,"However, the process appears to be patterned at the initial stages of bud formation, since the relative importance of these pathways and their downstream effectors differ as buds begin to develop and cell fates are specified."
3614,19,b,The development of a bud requires a number of coordinated changes in the behavior of the targeted cells within an epithelial sheet.
3615,20,b,"The process must be accompanied by alterations in the proliferation, polarity, shape, and adhesiveness of selected cells, as well as by modifications in their underlying basal lamina."
3616,21,b,"Thus, extracellular epithelial-mesenchymal crosstalk must be intricately orchestrated to couple the determination of distinct cell fates with the contemporaneous remodeling of the physical and structural properties of the cell."
3617,22,b,"Among the few dispensable organs, hair follicles offer an excellent model system to study epithelial bud formation."
3618,23,b,Mammalian skin epithelium begins as a single sheet of multipotent ectodermal cells.
3619,24,b,"During development, specialized mesenchymal cells populate the skin in a spatially defined pattern to initiate the complex epithelial-mesenchymal crosstalk that will specify the bud [<xref ref-type=""bibr"" rid=""pbio-0030011-b03"">3</xref>]."
3620,25,b,"Once committed, a small cluster of epithelial cells, the placode, instructs a group of underlying mesenchymal cells to condense and form the nascent dermal papilla, which will be a permanent fixture of the hair follicle."
3621,26,b,"Subsequent exchanges between the placode and nascent dermal papilla result in further growth of the follicle into the underlying dermis, or down-growth, and eventual differentiation into the six concentric layers of the mature follicle."
3622,27,b,"Previously, we delineated how two respective epithelial and mesenchymal signals, Wnts and the BMP-inhibitory factor noggin, function in concert to induce lymphoid enhancer factor-1/β-catenin (LEF-1/β-catenin)-mediated gene transcription within the follicle placode [<xref ref-type=""bibr"" rid=""pbio-0030011-b04"">4</xref>]."
3623,28,b,"The downstream changes elicited through convergence of these two early signaling pathways include down-regulation of the gene encoding E-cadherin, the prototypical epithelial cadherin that forms the transmembrane core of intercellular adherens junctions (AJs) [<xref ref-type=""bibr"" rid=""pbio-0030011-b05"">5</xref>]."
3624,29,b,"We subsequently showed that when E-cadherin is transgenically elevated in mouse skin, hair follicle morphogenesis is blocked, suggesting that E-cadherin down-regulation is a critical event in governing the adhesion dynamics necessary for budding morphogenesis [<xref ref-type=""bibr"" rid=""pbio-0030011-b04"">4</xref>]."
3625,30,b,"Like LEF-1, E-cadherin also binds to β-catenin."
3626,31,b,"At sites of cell-cell contact, however, E-cadherin-β-catenin complexes recruit α-catenin, which in turn coordinates the associated actin polymerization dynamics necessary to stabilize nascent AJs and integrate the cytoskeleton across an epithelial sheet [<xref ref-type=""bibr"" rid=""pbio-0030011-b06"">6</xref>,<xref ref-type=""bibr"" rid=""pbio-0030011-b07"">7</xref>,<xref ref-type=""bibr"" rid=""pbio-0030011-b08"">8</xref>]."
3627,32,b,"α-Catenin also binds to the class III Lin-1, Isl-1, Mec-3 (LIM) protein Ajuba (a member of the zyxin family of proteins), which appears to function dually in both adhesion and in activation of the Ras-mitogen-activated protein kinase (MAPK) pathway [<xref ref-type=""bibr"" rid=""pbio-0030011-b09"">9</xref>,<xref ref-type=""bibr"" rid=""pbio-0030011-b10"">10</xref>]."
3628,33,b,"Through these links, AJs appear able to couple adhesion with cytoskeletal dynamics as well as with nuclear and cytoplasmic signaling."
3629,34,b,"This provides a framework for conceptualizing why E-cadherin levels appear to impact upon a plethora of developmental processes (reviewed in [<xref ref-type=""bibr"" rid=""pbio-0030011-b11"">11</xref>])."
3630,35,b,"As we probed more deeply into the underlying mechanisms governing <i>E-cadherin</i> promoter activity, we were intrigued by the close proximity of the LEF-1/β-catenin binding site to a site known to bind the Snail/Slug family of zinc finger transcriptional repressor proteins [<xref ref-type=""bibr"" rid=""pbio-0030011-b12"">12</xref>,<xref ref-type=""bibr"" rid=""pbio-0030011-b13"">13</xref>,<xref ref-type=""bibr"" rid=""pbio-0030011-b14"">14</xref>,<xref ref-type=""bibr"" rid=""pbio-0030011-b15"">15</xref>]."
3631,36,b,"Both activity of Snail and down-regulation of E-cadherin play pivotal roles in epithelial to mesenchymal transitions (EMTs), typified by the transformation of polarized, adhering epithelial cells into motile mesenchymal cells [<xref ref-type=""bibr"" rid=""pbio-0030011-b16"">16</xref>,<xref ref-type=""bibr"" rid=""pbio-0030011-b17"">17</xref>]."
3632,37,b,"Bud formation differs from an EMT in that E-cadherin activity needs to be down-regulated but not prevented, so that adhesive junctions are remodeled rather than quantitatively impaired."
3633,38,b,"Supportive of an underlying ability to fine-tune cadherin expression at the transcriptional level, Snail seems to have an additive effect with LEF-1/β-catenin in negatively modulating <i>E-cadherin</i> promoter activity [<xref ref-type=""bibr"" rid=""pbio-0030011-b04"">4</xref>]."
3634,39,b,"In the present study, we discovered that Snail is expressed briefly at an early stage of hair bud formation, when E-cadherin down-regulation and activation of proliferation take place."
3635,40,b,"Thereafter, Snail disappears and remains absent during subsequent follicle down-growth and maturation."
3636,41,b,"This exquisite pattern appears to be functionally relevant since altering it in vivo correspondingly affects features associated with hair bud formation, including down-regulation of E-cadherin, increased proliferation, and repressed terminal differentiation."
3637,42,b,"Although the temporal spike of Snail in the hair bud is reflected at the mRNA level and seems to follow Wnt signaling and BMP inhibition, LEF-1/β-catenin activation does not appear to induce <i>Snail</i> gene expression in embryonic skin keratinocytes."
3638,43,b,"In contrast, we provide in vitro, transgenic (Tg), and gene targeting evidence to show that TGF-β2 and small phenotype– and mothers against decapentaplegic–related protein 2 (SMAD2) signaling are upstream inducers of <i>Snail</i> gene expression in skin epithelium."
3639,44,b,"In the absence of TGF-β2 signaling and <i>Snail</i> gene expression, hair placodes can form, but further follicle down-growth is blocked."
3640,45,b,"Our studies point to the view that Snail likely functions downstream of cell fate specification, at a stage where the bud begins to exhibit enhanced proliferation and migration."
3641,46,s,Results
3642,47,b,<i>Snail</i> mRNA and Protein Are Expressed Transiently at the Hair Bud Stage of Follicle Morphogenesis
3643,48,b,"Although Snail family members are most frequently associated with EMTs, they also participate in many malignant processes involving a down-regulation but not a quantitative abrogation of intercellular junctions [<xref ref-type=""bibr"" rid=""pbio-0030011-b18"">18</xref>]."
3644,49,b,The range of developmental processes in which Snail family members have been implicated thus includes the type of epithelial remodeling that is observed in hair follicle bud formation.
3645,50,b,"Given our prior observation that exogenously added Snail can participate with LEF-1/β-catenin in down-regulating <i>E-cadherin</i> expression in keratinocytes [<xref ref-type=""bibr"" rid=""pbio-0030011-b04"">4</xref>], coupled with the established requirement for LEF-1/β-catenin in hair follicle morphogenesis [<xref ref-type=""bibr"" rid=""pbio-0030011-b04"">4</xref>,<xref ref-type=""bibr"" rid=""pbio-0030011-b19"">19</xref>], we turned to addressing whether Snail/Slug family members might also participate in the process."
3646,51,b,PCR analyses identified transient <i>Snail</i> mRNA expression during a period of skin embryogenesis when waves of hair follicles are forming (unpublished data).
3647,52,b,"To pinpoint specifically where <i>Snail</i> mRNA is expressed in the developing skin, we conducted in situ hybridization using a cRNA probe unique to the <i>Snail</i> 3′ untranslated region (UTR)."
3648,53,b,"Embryonic day 17.5 (E17.5) was chosen, since the multiple waves of follicle morphogenesis occurring at this time enabled us to evaluate Snail expression at different stages of the process."
3649,54,b,"As shown in <xref ref-type=""fig"" rid=""pbio-0030011-g001"">Figure 1</xref>A, specific hybridization was detected within the epithelium of nascent hair buds."
3650,55,b,"By contrast, as follicles progressed further through their development (e.g., germ and peg stages), they exhibited no signs of hybridization (<xref ref-type=""fig"" rid=""pbio-0030011-g001"">Figure 1</xref>A)."
3651,56,b,"The transient nature of <i>Snail</i> mRNA expression during follicle development was most apparent in hybridized skin sections containing follicles from two different waves of morphogenesis (as shown in <xref ref-type=""fig"" rid=""pbio-0030011-g001"">Figure 1</xref>)."
3652,57,b,Hybridizing hair buds from a later wave appeared juxtaposed with nonhybridizing follicles from an earlier wave.
3653,58,b,"To determine whether this transient nature of <i>Snail</i> mRNA expression is reflected at the protein level, we generated an antibody against the N-terminal sequence that resides upstream of the more conserved zinc finger domains."
3654,59,b,"As judged by Western blot analysis, the antibody did not detect endogenous proteins from cultured keratinocytes, but it did yield a band of the expected size from keratinocytes transiently expressing a hemagglutinin (HA)-tagged Snail protein (<xref ref-type=""fig"" rid=""pbio-0030011-g001"">Figure 1</xref>B)."
3655,60,b,"The antibody also recognized a band corresponding to the size of endogenous Snail (approximately 28 kDa) in lysates from embryonic mouse skin, the temporal appearance of which corresponded to the waves of hair follicle morphogenesis from E15.5 to newborn when over 90% of the hair on the mouse is formed (<xref ref-type=""fig"" rid=""pbio-0030011-g001"">Figure 1</xref>B)."
3656,61,b,"Consistent with the Western blot data, immunohistochemical analysis did not detect Snail in single-layered E13.5 epidermis (<xref ref-type=""fig"" rid=""pbio-0030011-g001"">Figure 1</xref>C) nor in the placode, which is the earliest morphological sign of the commitment of multipotent cells of the embryonic ectoderm to a hair cell fate (<xref ref-type=""fig"" rid=""pbio-0030011-g001"">Figure 1</xref>D)."
3657,62,b,"Consistent with the in situ hybridization results, anti-Snail antibody labeled only hair buds and not follicles at more mature stages of development (<xref ref-type=""fig"" rid=""pbio-0030011-g001"">Figure 1</xref>E)."
3658,63,b,"Taken together, the anti-Snail antibody appeared to be specific for its target protein."
3659,64,b,It did not detect other Snail family members known to be expressed in keratinocytes and/or skin (unpublished data).
3660,65,b,"Furthermore, the immunohistochemical data paralleled our <i>Snail</i> in situ hybridization data revealing transient <i>Snail</i> expression at the hair bud stage (<xref ref-type=""fig"" rid=""pbio-0030011-g001"">Figure 1</xref>A)."
3661,66,b,"As judged by immunohistochemistry, Snail protein was localized to the nuclei of the hair bud cells (<xref ref-type=""fig"" rid=""pbio-0030011-g001"">Figure 1</xref>E)."
3662,67,b,"This feature was consistent with Snail's known function as a transcriptional repressor [<xref ref-type=""bibr"" rid=""pbio-0030011-b12"">12</xref>,<xref ref-type=""bibr"" rid=""pbio-0030011-b13"">13</xref>]."
3663,68,b,"Additionally, anti-Snail labeling was detected in only three of the four major waves of follicle morphogenesis."
3664,69,b,"Snail was not found in the buds of guard hairs that are the earliest of all hairs to form (at E13.5), and which constitute less than 5% of the mouse coat (unpublished data)."
3665,70,b,"As judged by immunofluorescence with antibodies against the proliferating nuclear antigen Ki67, the timing of Snail expression coincided with the stage at which the developing follicle enhanced its proliferation and down-growth (<xref ref-type=""fig"" rid=""pbio-0030011-g001"">Figure 1</xref>F)."
3666,71,b,"Immunohistochemistry with antibodies against the active (phosphorylated) form of MAPK (pMAPK) marked a subset of the proliferating (Ki67-positive) cells, and pMAPK-positive cells were enriched in the hair bud (<xref ref-type=""fig"" rid=""pbio-0030011-g001"">Figure 1</xref>G)."
3667,72,b,"The timing of Snail induction and Ki67 and pMAPK enrichment in the hair bud appeared to follow closely the induction of LEF-1/β-catenin activity, known to initiate in the hair placode stage [<xref ref-type=""bibr"" rid=""pbio-0030011-b20"">20</xref>]."
3668,73,b,"However, like placodes, hair buds exhibited down-regulation in E-cadherin expression (<xref ref-type=""fig"" rid=""pbio-0030011-g001"">Figure 1</xref>H; see also [<xref ref-type=""bibr"" rid=""pbio-0030011-b04"">4</xref>])."
3669,74,s,Sustained Expression of Snail Results in Epidermal Hyperproliferation and Differentiation Defects in Tg Mouse Skin
3670,75,b,The striking spike of Snail expression coincident with hair bud formation and enhanced proliferation prompted us to examine the consequences of ectopically expressing Snail elsewhere in mouse skin epidermis.
3671,76,b,"To distinguish Tg from endogenous Snail, we used the HA-epitope, shown previously not to alter Snail's transcriptional activity [<xref ref-type=""bibr"" rid=""pbio-0030011-b12"">12</xref>]."
3672,77,b,"Of 20 <i>K14-Snail[HA]</i> Tg animals generated, three expressed the transgene and all exhibited analogous phenotypes."
3673,78,b,Mice that integrated the transgene at the single-cell stage died at or shortly after birth.
3674,79,b,The three surviving full-Tg founder mice harbored transgene integrations that gave stable transmission of mosaic <i>Snail</i> gene expression through the germline.
3675,80,b,Progressively poor health necessitated our sacrificing most offspring from these lines within a year of birth.
3676,81,b,"As <i>Snail</i> Tg animals grew, they became distinguished by their small size, short tails, and flaky skin (<xref ref-type=""fig"" rid=""pbio-0030011-g002"">Figure 2</xref>A)."
3677,82,b,"Histological analyses of 3-d old (P3) mice revealed mosaic patches marked by epidermal thickening (<xref ref-type=""fig"" rid=""pbio-0030011-g002"">Figure 2</xref>B)."
3678,83,b,"The mosaic morphology was reflected at the level of Tg Snail protein, with only the hyperthickened regions expressing nuclear HA-tagged Snail (<xref ref-type=""fig"" rid=""pbio-0030011-g002"">Figure 2</xref>C)."
3679,84,b,"These hyperthickened areas were marked by excessive proliferation, as revealed by antibodies against the proliferating nuclear antigen Ki67 (<xref ref-type=""fig"" rid=""pbio-0030011-g002"">Figure 2</xref>D and <xref ref-type=""fig"" rid=""pbio-0030011-g002"">2</xref>E)."
3680,85,b,"Activated, pMAPK-positive cells were also prevalent in these areas (<xref ref-type=""fig"" rid=""pbio-0030011-g002"">Figure 2</xref>F and <xref ref-type=""fig"" rid=""pbio-0030011-g002"">2</xref>G), as were cells expressing keratin 6, a keratin induced in the suprabasal layers of hyperproliferative skin (<xref ref-type=""fig"" rid=""pbio-0030011-g002"">Figure 2</xref>H and <xref ref-type=""fig"" rid=""pbio-0030011-g002"">2</xref>I)."
3681,86,b,"Expression of the <i>Snail</i> transgene did not block terminal differentiation in the hyperproliferative epidermis, but it distorted it markedly (<xref ref-type=""fig"" rid=""pbio-0030011-g003"">Figure 3</xref>A–<xref ref-type=""fig"" rid=""pbio-0030011-g003"">3</xref>H)."
3682,87,b,"Typical of most hyperproliferating conditions, Snail expression led to a large expansion in layers with spinous and granular morphology."
3683,88,b,"Additionally, however, was a marked and variable expansion of keratin 5 (K5), normally restricted to the innermost basal layer (see <xref ref-type=""fig"" rid=""pbio-0030011-g003"">Figure 3</xref>)."
3684,89,b,"Although the failure of <i>Snail</i>-null mice to develop past gastrulation [<xref ref-type=""bibr"" rid=""pbio-0030011-b21"">21</xref>] precluded our ability to study the loss of Snail function in skin development, a good correlation emerged between the expression of Snail protein and the extension of K5, Ki67, and pMAPK suprabasally (compare data in <xref ref-type=""fig"" rid=""pbio-0030011-g002"">Figures 2</xref> and <xref ref-type=""fig"" rid=""pbio-0030011-g003"">3</xref>)."
3685,90,b,The changes in hyperproliferation and differentiation were not initially accompanied by gross signs of epithelial invaginations.
3686,91,b,"With age, however, epidermal folds and undulations developed in areas where Snail was expressed, and proliferative markers persisted in these regions (<xref ref-type=""fig"" rid=""pbio-0030011-g003"">Figure 3</xref>I and <xref ref-type=""fig"" rid=""pbio-0030011-g003"">3</xref>J; anti-cyclin D staining)."
3687,92,b,"The undulations were accompanied by partial dissolution of the underlying basement membrane (<xref ref-type=""fig"" rid=""pbio-0030011-g003"">Figure 3</xref>K and <xref ref-type=""fig"" rid=""pbio-0030011-g003"">3</xref>L)."
3688,93,b,"Aberrant staining was also observed with antibodies against components of the hemidesmosomes, which provide strong adhesion of basal epidermal cells to the underlying basal lamina (<xref ref-type=""fig"" rid=""pbio-0030011-g003"">Figure 3</xref>M and <xref ref-type=""fig"" rid=""pbio-0030011-g003"">3</xref>N)."
3689,94,b,"Interestingly, similar types of alterations occur in the basement membrane in the hair bud of embryonic and newborn mice when Snail is normally expressed."
3690,95,b,The fact that the basement membrane separating the epidermis from the dermis is altered only in the adult Tg animals suggests the involvement of intermediary factors not as readily available in the epidermis as they are in the follicle.
3691,96,s,Possible Links between Epidermal Hyperproliferation and Down-regulation of AJ Proteins in <i>Snail</i> Tg Mice
3692,97,b,"Given that the <i>E-cadherin</i> promoter is a direct target for Snail-mediated repression in vitro [<xref ref-type=""bibr"" rid=""pbio-0030011-b04"">4</xref>,<xref ref-type=""bibr"" rid=""pbio-0030011-b12"">12</xref>,<xref ref-type=""bibr"" rid=""pbio-0030011-b13"">13</xref>], and that E-cadherin was down-regulated in Snail-expressing hair buds, we examined the status of E-cadherin and other AJ proteins within regions of hyperproliferative epidermis where Tg Snail was present (<xref ref-type=""fig"" rid=""pbio-0030011-g004"">Figure 4</xref>A)."
3693,98,b,"In these regions, immunofluorescence staining of E-cadherin and α-catenin were markedly diminished."
3694,99,b,"In contrast, the intensity of antibody staining for two other AJ proteins, β-catenin and Ajuba, was still strong."
3695,100,b,"Interestingly, however, despite appreciable immunofluorescence, localization of β-catenin and Ajuba appeared to be largely cytoplasmic rather than at cell-cell borders (<xref ref-type=""fig"" rid=""pbio-0030011-g004"">Figure 4</xref>A insets)."
3696,101,b,Architectural differences in the epidermis made Western blot analyses somewhat difficult to gauge.
3697,102,b,"However, in regions such as ear skin, where the highest levels of Snail protein were expressed, the effects were accentuated."
3698,103,b,"In both back skin and ear skin, overall levels of E-cadherin and α-catenin were reduced, under conditions where β-catenin and Ajuba levels remained unchanged relative to controls (<xref ref-type=""fig"" rid=""pbio-0030011-g004"">Figure 4</xref>B)."
3699,104,b,"Taken together, these data were consistent with our results obtained from immunofluorescence microscopy."
3700,105,b,"A priori, the decrease in α-catenin levels could be due to either direct transcriptional repression by Snail or perturbations in AJ formation caused by the decrease in <i>E-cadherin</i> gene expression."
3701,106,b,"To distinguish between these possibilities, we tested whether α-catenin levels could be restored by exogenous expression of <i>E-cadherin</i> in Snail-expressing keratinocytes."
3702,107,b,"As shown in <xref ref-type=""fig"" rid=""pbio-0030011-g004"">Figure 4</xref>C, transiently transfected keratinocytes expressing HA-tagged Snail displayed a loss of E-cadherin and α-catenin at cell-cell borders."
3703,108,b,"Coexpression of exogenous HA-tagged E-cadherin not only enabled cell-cell border localization of E-cadherin protein, but also rescued the cell-cell border staining of α-catenin (<xref ref-type=""fig"" rid=""pbio-0030011-g004"">Figure 4</xref>C)."
3704,109,b,The ability to restore α-catenin expression and localization under these conditions argues against the notion that Snail transcriptionally represses <i>α-catenin.</i>
3705,110,b,"Rather, the findings are consistent with a previous report that E-cadherin is required for the translation of <i>α-catenin</i> mRNA [<xref ref-type=""bibr"" rid=""pbio-0030011-b22"">22</xref>]."
3706,111,b,"Despite the reductions in AJ markers, Tg skin still displayed sealed membranes and intercellular junctions that were largely intact, as judged by ultrastructural analyses (unpublished data)."
3707,112,b,"In this respect, the skin epithelium resembled that of the hair bud, where the down-regulation in junction proteins is permissive for cell-cell remodeling without abrogating intercellular adhesion."
3708,113,b,"The similarities between <i>Snail</i> Tg epidermis and hair buds extended to the hyperproliferative state, leading us to wonder whether the down-regulation of AJ proteins might contribute to this condition."
3709,114,b,"Given the increase in pMAPK staining in <i>Snail</i> Tg epidermis (see <xref ref-type=""fig"" rid=""pbio-0030011-g002"">Figure 2</xref>G), we used pMAPK levels as our assay to test whether the loss of E-cadherin contributed to the Snail-mediated increase in proliferation."
3710,115,b,"Consistent with our in vivo observations, transfected keratinocytes expressing Snail exhibited a substantial increase in pMAPK levels relative to control cells (<xref ref-type=""fig"" rid=""pbio-0030011-g004"">Figure 4</xref>D)."
3711,116,b,Coexpression of E-cadherin with Snail appeared to abrogate this effect.
