,doc_sent_idx,sent_type,snt
3712,117,b,"Together, these findings raised the possibility that an AJ-associated protein that is normally sequestered at the plasma membrane may participate in a proliferation signaling pathway when AJs are deconstructed."
3713,118,b,"Numerous studies have correlated a down-regulation of E-cadherin with a translocation of β-catenin to the nucleus and a transactivation of genes that are regulated by the LEF-1/T cell factor (TCF) family of DNA binding proteins [<xref ref-type=""bibr"" rid=""pbio-0030011-b23"">23</xref>,<xref ref-type=""bibr"" rid=""pbio-0030011-b24"">24</xref>,<xref ref-type=""bibr"" rid=""pbio-0030011-b25"">25</xref>]."
3714,119,b,"The presence of nuclear cyclin D in hyperproliferative <i>Snail</i> Tg epidermis was particularly intriguing since prior studies have reported <i>cyclin D</i> gene as a direct target of TCF/β-catenin transcription [<xref ref-type=""bibr"" rid=""pbio-0030011-b26"">26</xref>]."
3715,120,b,"This said, we did not detect nuclear β-catenin in our Tg epidermis, and mating the Snail Tg mice against the TOPGal reporter mouse [<xref ref-type=""bibr"" rid=""pbio-0030011-b20"">20</xref>] gave no signs of ectopic LEF-1/Tcf/β-catenin activity (unpublished data)."
3716,121,b,We next turned to the presence of cytoplasmic Ajuba for a possible mechanistic link to the proliferative increase in our <i>Snail</i> Tg epidermis.
3717,122,b,"In addition to its documented ability to bind α-catenin [<xref ref-type=""bibr"" rid=""pbio-0030011-b10"">10</xref>], Ajuba can also associate with growth factor receptor-bound protein-2 (Grb-2)/son of sevenless (Sos), the nucleotide exchange factor for Ras, which is upstream from activation of MAPK [<xref ref-type=""bibr"" rid=""pbio-0030011-b09"">9</xref>]."
3718,123,b,"Given the increase in pMAPK staining in Tg skin, we examined the possibility that Ajuba might have changed its binding partner in Snail-expressing epidermis."
3719,124,b,"Interestingly, Ajuba was readily detected in anti-Grb-2 immunoprecipitates of protein lysates from skins of <i>Snail</i> Tg mice but not from the corresponding wild-type (WT) animals (<xref ref-type=""fig"" rid=""pbio-0030011-g004"">Figure 4</xref>E)."
3720,125,b,"When these experiments were repeated with <i>α-catenin</i>-null epidermis, a similar Grb-2-Ajuba association was detected, and again, this interaction was not detected in the protein extracts from control littermate skin (<xref ref-type=""fig"" rid=""pbio-0030011-g004"">Figure 4</xref>E)."
3721,126,b,"Together, these data demonstrate that the reduction in α-catenin levels, either by Snail-mediated down-regulation of <i>E-cadherin</i> or by <i>α-catenin</i> conditional targeting, allows Ajuba to interact with Grb-2/Sos."
3722,127,b,"If the competition between Grb-2/Sos and α-catenin for Ajuba is functionally relevant to the hyperproliferative state of a keratinocyte, then overexpression of Ajuba would be expected to bypass the competition and promote activation of the Ras-MAPK pathway in WT keratinocytes."
3723,128,b,"Indeed, when serum-starved keratinocytes were transiently transfected with an Ajuba expression vector, the levels of pMAPK were not only elevated but also comparable to those transfected with the <i>K14-HASnail</i> transgene (<xref ref-type=""fig"" rid=""pbio-0030011-g004"">Figure 4</xref>F)."
3724,129,b,"This activation was abolished when cells were treated with a small peptide inhibitor that specifically interrupts the Grb-2/Sos interaction (<xref ref-type=""fig"" rid=""pbio-0030011-g004"">Figure 4</xref>F; see lanes marked “inh”) [<xref ref-type=""bibr"" rid=""pbio-0030011-b27"">27</xref>]."
3725,130,b,"Ajuba's pre-LIM domain is the segment that associates with Grb-2's Src-homology 3 domain [<xref ref-type=""bibr"" rid=""pbio-0030011-b09"">9</xref>]."
3726,131,b,"When this domain was overexpressed in serum-starved keratinocytes, a comparable elevation in pMAPK was observed (<xref ref-type=""fig"" rid=""pbio-0030011-g004"">Figure 4</xref>F)."
3727,132,b,"As expected, the small peptide inhibitor that interrupts the Grb-2/Sos association blocked the effects."
3728,133,b,"These data suggested that by elevating cytosolic Ajuba levels, Ajuba's pre-LIM domain may associate with Grb-2/Sos in a manner that stimulates its nucleotide exchange activity and leads to activation of the Ras-MAPK pathway."
3729,134,b,"Although this pathway provides one mechanism by which Snail expression and proliferation may be coupled in skin epithelium, proliferative circuitries involving AJs are known to be complex and often interwoven."
3730,135,b,Future studies will be needed to systematically dissect these putative intricacies at a molecular level.
3731,136,s,Probing the Regulation of <i>Snail</i> Gene Expression Reveals an Essential Link to TGF-β2 Signaling in the Developing Hair Bud
3732,137,b,The temporal spike of <i>Snail</i> mRNA expression in the hair bud prompted us to consider what factor(s) may be regulating the <i>Snail</i> gene.
3733,138,b,"A variety of extracellular signals have an impact on the cell type-specific expression of different Snail family members, and many of them, including Wnts, BMPs, FGFs, and TGF-βs, also affect hair bud development [<xref ref-type=""bibr"" rid=""pbio-0030011-b02"">2</xref>,<xref ref-type=""bibr"" rid=""pbio-0030011-b16"">16</xref>,<xref ref-type=""bibr"" rid=""pbio-0030011-b28"">28</xref>]."
3734,139,b,"Since Snail is not expressed in cultured skin keratinocytes that secrete active BMPs and FGFs (see <xref ref-type=""fig"" rid=""pbio-0030011-g001"">Figure 1</xref>B), we focused our attention on Wnt and TGF-β signaling as more likely candidates for Snail induction in this cell type."
3735,140,b,"Previously, we showed that effective transmission of a Wnt-3a signal in cultured keratinocytes can be achieved through their exposure to the BMP inhibitor noggin, which induces LEF-1 expression [<xref ref-type=""bibr"" rid=""pbio-0030011-b04"">4</xref>]."
3736,141,b,"In vitro, these conditions down-regulated the <i>E-cadherin</i> promoter and induced a LEF-1/β-catenin-sensitive reporter gene, <i>TOPFLASH</i> [<xref ref-type=""bibr"" rid=""pbio-0030011-b04"">4</xref>]."
3737,142,b,"In contrast, Snail expression was not induced by these conditions (<xref ref-type=""fig"" rid=""pbio-0030011-g005"">Figure 5</xref>A)."
3738,143,b,"Thus, despite essential roles for Wnts and noggin in hair follicle specification [<xref ref-type=""bibr"" rid=""pbio-0030011-b04"">4</xref>,<xref ref-type=""bibr"" rid=""pbio-0030011-b29"">29</xref>,<xref ref-type=""bibr"" rid=""pbio-0030011-b30"">30</xref>], our studies did not support an essential role for these signals in governing <i>Snail</i> expression in keratinocytes."
3739,144,b,"TGF-β1 has been shown to induce Snail family members in hepatocytes and heart [<xref ref-type=""bibr"" rid=""pbio-0030011-b15"">15</xref>, <xref ref-type=""bibr"" rid=""pbio-0030011-b31"">31</xref>]."
3740,145,b,"In keratinocytes, however, TGF-β1 inhibits keratinocyte growth and seems to be involved in triggering the destructive phase of the cycling hair follicle [<xref ref-type=""bibr"" rid=""pbio-0030011-b32"">32</xref>]."
3741,146,b,"Of the loss-of-function mutations generated in each of the <i>TGF-β</i> genes, only the <i>TGF-β2</i> null state blocked follicle development at the hair bud stage [<xref ref-type=""bibr"" rid=""pbio-0030011-b32"">32</xref>]."
3742,147,b,"Thus, we turned towards addressing whether TGF-β2 might be involved in regulating <i>Snail</i> expression in keratinocytes isolated from the basal layer of the epidermis."
3743,148,b,"Though there is no cell culture system available to specifically study placodal cells, these keratinocytes are their progenitors and are the closest approximation available to study the behavior of epithelial cells of the placode."
3744,149,b,"Interestingly, treatment of cultured keratinocytes with as little as 5 ng/ml of TGF-β2 caused a rapid and transient induction of Snail (<xref ref-type=""fig"" rid=""pbio-0030011-g005"">Figure 5</xref>B)."
3745,150,b,"Following this treatment, Snail protein was detected within 30 min, peaked at 2 h, and then declined thereafter."
3746,151,b,"The induction of Snail appeared to be specific for the active form of the growth factor, as pretreatment of TGF-β2 for 10 min at 100 °C obliterated the response [<xref ref-type=""fig"" rid=""pbio-0030011-g005"">Figure 5</xref>B, lanes marked (–)]."
3747,152,b,"By contrast, although TGF-β receptor activation remained elevated during the duration of the experiment (as measured by the sustained phosphorylation of the downstream effector SMAD2) <i>Snail</i> expression could not be maintained (<xref ref-type=""fig"" rid=""pbio-0030011-g005"">Figure 5</xref>B)."
3748,153,b,"Thus, although <i>Snail</i> expression correlated with phosphorylated SMAD2 (pSMAD2) induction, its decline seemed to rely on secondary downstream events."
3749,154,b,"The rapid kinetics of Snail expression were reflected at the mRNA level, suggesting that <i>Snail</i> promoter activity in keratinocytes might be sensitive to TGF-β2 signaling (<xref ref-type=""fig"" rid=""pbio-0030011-g005"">Figure 5</xref>C)."
3750,155,b,"To test this possibility, we engineered a transgene driving the β-galactosidase reporter under the control of approximately 2.2 kb of promoter sequence located 5′ from the transcription initiation site of the mouse <i>Snail</i> gene."
3751,156,b,"At 2 d after transient transfection, keratinocytes were treated with TGF-β2 (t = 0) and then assayed for transgene activity over the same time course in which we had observed Snail protein induction."
3752,157,b,"The results of this experiment are presented in <xref ref-type=""fig"" rid=""pbio-0030011-g005"">Figure 5</xref>D."
3753,158,b,"Within 0.5 h of TGF-β2 treatment, <i>Snail</i> promoter activity had increased 3-fold, and by 2 h, it peaked to approximately 10-fold over control levels (<xref ref-type=""fig"" rid=""pbio-0030011-g005"">Figure 5</xref>D)."
3754,159,b,"Thereafter, <i>Snail</i> promoter activity rapidly returned to the basal levels seen in unstimulated keratinocytes."
3755,160,b,The kinetics of <i>Snail</i> promoter activity closely paralleled those observed for Snail protein induction.
3756,161,b,"Moreover, the stimulatory effects appeared to be specific to TGF-β2, since they were abrogated either by heat inactivation of the TGF-β2 protein or by mutation of a putative SMAD binding element located about 1.8 kb 5′ from the <i>Snail</i> transcription start site (<xref ref-type=""fig"" rid=""pbio-0030011-g005"">Figure 5</xref>D)."
3757,162,b,"Taken together, these results suggested that in keratinocytes, TGF-β2 signaling results in a pSMAD2-dependent transient activation of the <i>Snail</i> gene, and that maintenance of Snail protein relies, in part, upon sustained promoter activity."
3758,163,b,The brevity of <i>Snail</i> gene and protein induction in TGF-β2 treated cultured keratinocytes resembled the temporal appearance of <i>Snail</i> mRNA and protein at the initiation of hair follicle morphogenesis in embryonic mouse skin.
3759,164,b,"To test whether TGF-β2 might be required for <i>Snail</i> induction in hair bud formation in vivo, we first analyzed whether TGF-β2 was expressed in or around the hair bud."
3760,165,b,"Consistent with previous observations [<xref ref-type=""bibr"" rid=""pbio-0030011-b33"">33</xref>], an anti-TGF-β2 antibody labeled developing hair buds (<xref ref-type=""fig"" rid=""pbio-0030011-g006"">Figure 6</xref>A)."
3761,166,b,"This labeling appeared to be specific as judged by the lack of staining in follicle buds from mice homozygous for a <i>TGF-β2</i> null mutation (<xref ref-type=""fig"" rid=""pbio-0030011-g006"">Figure 6</xref>A; [<xref ref-type=""bibr"" rid=""pbio-0030011-b34"">34</xref>])."
3762,167,b,"Moreover, the downstream effector of TGF-β2 signaling, pSMAD2, was also expressed in WT, but not <i>TGF-β2</i>-null, hair buds (<xref ref-type=""fig"" rid=""pbio-0030011-g006"">Figure 6</xref>B)."
3763,168,b,"Together, these data underscore the importance of the TGF-β2 isoform despite expression of both TGF-β1 and TGF-β2 in developing hair buds at this stage."
3764,169,b,"To further explore the possible relation between Snail and TGF-β2, we examined the status of Snail expression in <i>TGF-β2</i>-null hair buds."
3765,170,b,"As judged by immunohistochemistry, Snail protein was absent from E17.5 skin of <i>TGF-β2-</i>null embryos but not from that of control littermates (<xref ref-type=""fig"" rid=""pbio-0030011-g006"">Figure 6</xref>C)."
3766,171,b,"This effect appeared to be exerted at the transcriptional level, since <i>Snail</i> mRNAs were also not found in <i>TGF-β2</i> null hair buds under conditions in which the signal was readily detected in the hair buds of littermate skin (<xref ref-type=""fig"" rid=""pbio-0030011-g006"">Figure 6</xref>D)."
3767,172,b,"Conversely, in 2-wk-old <i>K14-Smad2</i> Tg mice, which display elevated TGF-β signaling in skin [<xref ref-type=""bibr"" rid=""pbio-0030011-b35"">35</xref>], Snail protein was readily detected by Western blot analyses, where it was not found in postnatal skin (<xref ref-type=""fig"" rid=""pbio-0030011-g006"">Figure 6</xref>E)."
3768,173,b,"Taken together, these results provide compelling evidence that TGF-β2 is functionally important for inducing <i>Snail</i> gene expression in a pSMAD-dependent manner in developing hair buds."
3769,174,b,"Whether pMARK activity also contributes to Snail induction was not addressed in the present study [<xref ref-type=""bibr"" rid=""pbio-0030011-b15"">15</xref>]."
3770,175,b,"Although some hair buds still formed in <i>TGF-β2</i> null skin, their number was reduced by approximately 50% [<xref ref-type=""bibr"" rid=""pbio-0030011-b32"">32</xref>]."
3771,176,b,"Thus, although the pathway mediated by TGF-β2 signaling impacts the earliest step of epithelial invagination, it does not appear to be essential for bud morphogenesis."
3772,177,b,"Consistent with this notion, basement membrane remodeling still took place in the <i>TGF-β2</i>-null buds, as judged by immunofluorescence with antibodies against β4 integrin, an integral component of keratinocyte-mediated adhesion to its underlying basement membrane (<xref ref-type=""fig"" rid=""pbio-0030011-g006"">Figure 6</xref>F)."
3773,178,b,"In contrast, TGF-β2 signaling appeared to be an important factor for the early proliferation that occurs in the developing hair buds, as judged by anti-Ki67 and anti-pMAPK immunofluorescence (<xref ref-type=""fig"" rid=""pbio-0030011-g006"">Figure 6</xref>F and <xref ref-type=""fig"" rid=""pbio-0030011-g006"">6</xref>G)."
3774,179,b,"If TGF-β2 stimulates <i>Snail</i> expression in developing buds, loss of this morphogen would be expected to affect the expression of genes that are typically repressed by Snail."
3775,180,b,"Since a major target for Snail-mediated repression is the <i>E-cadherin</i> gene [<xref ref-type=""bibr"" rid=""pbio-0030011-b12"">12</xref>,<xref ref-type=""bibr"" rid=""pbio-0030011-b13"">13</xref>], we investigated the status of E-cadherin in <i>TGF-β2</i>-null buds."
3776,181,b,"As shown in <xref ref-type=""fig"" rid=""pbio-0030011-g006"">Figure 6</xref>H, hair buds in TGF-β2 null skin displayed elevated immunofluorescence staining relative to their WT counterparts."
3777,182,b,Previously we demonstrated that the concerted action of the extracellular signals Wnt and noggin are required for the generation of a LEF-1/β-catenin transcription complex to repress <i>E-cadherin</i> transcription at the onset of hair fate specification.
3778,183,b,"As shown in <xref ref-type=""fig"" rid=""pbio-0030011-g006"">Figure 6</xref>I and <xref ref-type=""fig"" rid=""pbio-0030011-g006"">6</xref>J, both WT and TGF-β2 null buds exhibited nuclear LEF-1 and β-catenin localization, signs that the Wnt-noggin signaling pathway was intact."
3779,184,b,"These data suggest that during hair follicle morphogenesis, TGF-β2 functions subsequently to Wnt/noggin-mediated determination of hair fate."
3780,185,b,"Moreover, through activation of <i>Snail</i> gene expression, TGF-β2 appears to work in tandem with these other morphogens to down-regulate E-cadherin levels, which contributes to the activation of proliferative circuitries."
3781,186,s,Discussion
3782,187,b,"During budding morphogenesis, intersecting signaling networks from the epithelium and mesenchyme govern transcriptional, adhesive, polarity, and motility programs in these select groups of cells."
3783,188,b,The dynamic nuclear and cytosolic changes that take place during this time form the cornerstone for organ morphogenesis.
3784,189,b,"Two major challenges in understanding the mechanisms underlying a particular budding process are to order the temporal sequence of external cues involved and then to dissect how the cells of the developing bud translate these signals into the downstream events of cellular remodeling, proliferation, and differentiation."
3785,190,b,Our studies here provide some insights into how these events are orchestrated during hair bud formation in developing skin.
3786,191,s,Signaling during Early Hair Follicle Morphogenesis
3787,192,b,"Recent studies on hair bud morphogenesis suggest that Wnt signals likely from the epithelium and BMP inhibitory signals from the underlying mesenchyme converge to produce an active transcription factor complex involving β-catenin and LEF-1, which in turn plays a key role in specifying the hair follicle fate [<xref ref-type=""bibr"" rid=""pbio-0030011-b04"">4</xref>,<xref ref-type=""bibr"" rid=""pbio-0030011-b29"">29</xref>,<xref ref-type=""bibr"" rid=""pbio-0030011-b30"">30</xref>,<xref ref-type=""bibr"" rid=""pbio-0030011-b36"">36</xref>,<xref ref-type=""bibr"" rid=""pbio-0030011-b37"">37</xref>]."
3788,193,b,"Sonic hedgehog (Shh) and TGF-β2 signaling also play essential roles in follicle morphogenesis, but in contrast to <i>β-catenin</i> null skin, in which follicle invaginations are absent [<xref ref-type=""bibr"" rid=""pbio-0030011-b30"">30</xref>], some hair buds still form in the absence of LEF-1, Shh, or TGF-β2 [<xref ref-type=""bibr"" rid=""pbio-0030011-b32"">32</xref>,<xref ref-type=""bibr"" rid=""pbio-0030011-b38"">38</xref>]."
3789,194,b,"These likely reflect the first wave of follicle (i.e., guard hair) morphogenesis, which accounts for a small number (fewer than 5%) of hairs and is under distinct regulatory control."
3790,195,b,"Guard hairs form in the absence of LEF-1 and TGF-β2, and we have found that they also fail to express Snail at the budding stage of development (unpublished data)."
3791,196,b,How E-cadherin is regulated in guard hairs remains to be determined.
3792,197,b,"Several candidates include other Snail family members such as Slug or twist, or alternatively, transcription factors involving β-catenin and a different member of the LEF-1/TCF/<i>Sry</i>-type HMG box (commonly known as SOX) family [<xref ref-type=""bibr"" rid=""pbio-0030011-b39"">39</xref>,<xref ref-type=""bibr"" rid=""pbio-0030011-b40"">40</xref>]."
3793,198,b,Further investigation will be required to determine whether the signaling pathway we have elucidated here is a theme with multiple variations.
3794,199,b,"TGF-βs are known to promote withdrawal of keratinocytes from the cell cycle [<xref ref-type=""bibr"" rid=""pbio-0030011-b41"">41</xref>]."
3795,200,b,"Hence, when TGF-β2 protein was detected at the transition between the growing and destructive phases of the adult hair cycle, research initially and naturally focused on a role for this family member in cessation of growth and/or triggering apoptosis ([<xref ref-type=""bibr"" rid=""pbio-0030011-b42"">42</xref>] and references therein)."
3796,201,b,"However, in contrast to <i>TGF-β1</i>-null skin, which exhibits an extended growing phase of postnatal hair follicles, <i>TGF-β2</i>-null skin displays an embryonic block in follicle bud progression [<xref ref-type=""bibr"" rid=""pbio-0030011-b32"">32</xref>]."
3797,202,b,"Although this phenotype is consistent with TGF-β2's embryonic expression patterns [<xref ref-type=""bibr"" rid=""pbio-0030011-b33"">33</xref>], about 50% of <i>TGF-β2</i> null buds appear unable to progress to the down-growth phase, a feature that cannot be explained readily on the basis of previously established effects of TGF-βs."
3798,203,b,Our finding that TGF-β2 is upstream from Ki67 expression and MAPK activation lends further support to the notion that hair follicle keratinocytes at this early stage of development react to TGF-β2 signaling in a fashion opposite to that typically expected for TGF-β factors.
3799,204,b,"This said, based upon pSMAD2 immunohistochemistry, the immediate steps of downstream signaling appeared to be intact."
3800,205,b,"Thus, we surmise that the proliferative outcome is likely to be rooted in differences in the repertoire of activated SMAD target genes."
3801,206,b,"In this regard, the positive effects of TGF-β2 on proliferation within the hair bud may be more analogous to what has been seen in progression of squamous cell carcinoma to metastatic carcinoma [<xref ref-type=""bibr"" rid=""pbio-0030011-b43"">43</xref>] rather than that typically observed for keratinocytes [<xref ref-type=""bibr"" rid=""pbio-0030011-b44"">44</xref>,<xref ref-type=""bibr"" rid=""pbio-0030011-b45"">45</xref>,<xref ref-type=""bibr"" rid=""pbio-0030011-b46"">46</xref>]."
3802,207,b,"The prior identification of the <i>Snail</i> gene as a potential target of TGF-β signaling [<xref ref-type=""bibr"" rid=""pbio-0030011-b15"">15</xref>] was intriguing, given the temporal wave of <i>Snail</i> gene expression that occurs in the developing hair bud."
3803,208,b,The additional correlation between epithelial hyperproliferation and <i>Snail</i> transgene expression further fostered our interest in a possible link between TGF-β2 and Snail.
3804,209,b,"Our functional studies demonstrate that without TGF-β2, <i>Snail</i> expression is abolished in the mutant hair buds, and conversely, in <i>K14-Smad2</i> skin, <i>Snail</i> is ectopically activated."
3805,210,b,"Moreover, our in vitro studies indicate that even sustained TGF-β2 exposure may cause only a transient induction of Snail, offering a possible explanation as to why Snail is so briefly expressed during hair follicle morphogenesis."
3806,211,b,"An additional point worth mentioning is that prolonged expression of Tg <i>Snail</i> in postnatal skin resulted in morphological and biochemical signs of epithelial to mesenchymal transitions (unpublished data), underscoring why transient Snail expression may be so important during normal hair follicle morphogenesis [<xref ref-type=""bibr"" rid=""pbio-0030011-b18"">18</xref>]."
3807,212,b,"At first glance, the sparsity in hair coat of K14-<i>Snail</i> Tg mice seemed indicative of a defect in follicle formation (see <xref ref-type=""fig"" rid=""pbio-0030011-g002"">Figure 2</xref>A)."
3808,213,b,"Closer inspection, however, revealed that not all hairs penetrated the hyperthickened Tg epidermis."
3809,214,b,Several factors may contribute to the seemingly normal follicle development in these mice.
3810,215,b,"One obvious factor is the K14 promoter, which is elevated in the basal layer of the epidermis and the outer root sheath (ORS) of the hair follicle, but is markedly down-regulated in developing embryonic hair buds as well as in the postnatal hair progenitor cells."
3811,216,b,The K14 promoter is also less active in the ORS than epidermis and hence this might also account for the lack of apparent response of the ORS to ectopic Snail.
3812,217,b,"Additional contributing factors could be the multiplicity of Snail family members and their differential expression, the saturation, and/or diversity of regulatory mechanisms that govern AJ formation, migration, and proliferation in the follicle ORS."
3813,218,b,Distinguishing between these possibilities must await the generation of mice harboring skin-specific loss-of-function <i>Snail</i> mutations.
3814,219,s,"Links between Signaling, Transcriptional Cascades, Epithelial Remodeling, and Proliferation in the Hair Bud"
3815,220,b,"Previously, we discovered that early during hair follicle morphogenesis, <i>E-cadherin</i> gene expression is down-regulated concomitantly with the invagination of developing bud cells into the skin [<xref ref-type=""bibr"" rid=""pbio-0030011-b04"">4</xref>]."
3816,221,b,"Because the timing of this event correlated with the activation of a LEF-1/β-catenin transcription factor complex [<xref ref-type=""bibr"" rid=""pbio-0030011-b20"">20</xref>], we were intrigued by the presence of a putative LEF-1/TCF binding site in the <i>E-cadherin</i> promoter."
3817,222,b,"This prompted an investigation that subsequently led to our discovery that LEF-1/β-catenin can contribute to repression of <i>E-cadherin</i> gene expression in skin keratinocytes [<xref ref-type=""bibr"" rid=""pbio-0030011-b04"">4</xref>]."
3818,223,b,"In the course of these studies, we also noted that Snail can also contribute to this process in keratinocytes in vitro, and our present studies revealed that Snail is expressed at the right place and time to be physiologically relevant in the process."
3819,224,b,"In <i>noggin</i>-null embryonic skin, LEF-1 expression and subsequent activation of the LEF-1/β-catenin reporter gene is abrogated in the developing placodes."
3820,225,b,"The corresponding failure of <i>E-cadherin</i> down-regulation underscores the importance of Wnt/noggin signaling in regulating this event in follicle morphogenesis [<xref ref-type=""bibr"" rid=""pbio-0030011-b04"">4</xref>]."
